{
  "id": "battuta-cover",
  "type": "asset",
  "media": "image",
  "title": { "en": "Ibn Battuta — cover", "ar": "غلاف: ابن بطوطة" },
  "alt_text": { "en": "Stylised cover image showing Ibn Battuta's 30-year route across the medieval Islamic world." },
  "src": "data:image/svg+xml;utf8,%3Csvg xmlns='http://www.w3.org/2000/svg' viewBox='0 0 1200 630' width='1200' height='630'%3E%3Cdefs%3E%3ClinearGradient id='g' x1='0' x2='1' y1='0' y2='1'%3E%3Cstop offset='0' stop-color='%230a3622'/%3E%3Cstop offset='1' stop-color='%231f7a4d'/%3E%3C/linearGradient%3E%3C/defs%3E%3Crect width='1200' height='630' fill='url(%23g)'/%3E%3Cpath d='M 90 350 Q 250 250 380 270 T 580 300 T 760 250 T 920 280 T 1110 240' stroke='%23f5d76e' stroke-width='5' fill='none' stroke-dasharray='2 14' stroke-linecap='round'/%3E%3Cg fill='%23f5d76e'%3E%3Ccircle cx='90'   cy='350' r='8'/%3E%3Ccircle cx='380'  cy='270' r='6'/%3E%3Ccircle cx='580'  cy='300' r='6'/%3E%3Ccircle cx='760'  cy='250' r='6'/%3E%3Ccircle cx='920'  cy='280' r='6'/%3E%3Ccircle cx='1110' cy='240' r='8'/%3E%3C/g%3E%3Ctext x='60' y='160' fill='%23ffffff' font-family='system-ui,sans-serif' font-size='74' font-weight='700'%3EIbn Battuta%3C/text%3E%3Ctext x='60' y='220' fill='%23dfece6' font-family='system-ui,sans-serif' font-size='30'%3EThirty Years on the Road · 1325–1354%3C/text%3E%3Ctext x='65'   y='400' fill='%23ffffff' font-family='system-ui,sans-serif' font-size='18'%3ETangier%3C/text%3E%3Ctext x='355'  y='320' fill='%23ffffff' font-family='system-ui,sans-serif' font-size='18'%3ECairo%3C/text%3E%3Ctext x='565'  y='350' fill='%23ffffff' font-family='system-ui,sans-serif' font-size='18'%3EMecca%3C/text%3E%3Ctext x='735'  y='300' fill='%23ffffff' font-family='system-ui,sans-serif' font-size='18'%3EDelhi%3C/text%3E%3Ctext x='890'  y='330' fill='%23ffffff' font-family='system-ui,sans-serif' font-size='18'%3EZaytun%3C/text%3E%3Ctext x='1058' y='290' fill='%23ffffff' font-family='system-ui,sans-serif' font-size='18'%3E(China)%3C/text%3E%3Ctext x='60' y='590' fill='%23dfece6' font-family='system-ui,sans-serif' font-size='22'%3E~75,000 miles · seven Hajjs · the longest documented journey of the pre-modern world%3C/text%3E%3C/svg%3E",
  "license": "CC-BY-4.0",
  "attribution": { "en": "islamicmaps.org" }
}
