{
  "id": "hijra-cover",
  "type": "asset",
  "media": "image",
  "title": { "en": "The Hijra — cover", "ar": "غلاف: الهجرة" },
  "alt_text": { "en": "Stylised gradient cover image for the Hijra story (Mecca to Medina)" },
  "src": "data:image/svg+xml;utf8,%3Csvg xmlns='http://www.w3.org/2000/svg' viewBox='0 0 1200 630' width='1200' height='630'%3E%3Cdefs%3E%3ClinearGradient id='g' x1='0' x2='1' y1='0' y2='1'%3E%3Cstop offset='0' stop-color='%230f5132'/%3E%3Cstop offset='1' stop-color='%231f7a4d'/%3E%3C/linearGradient%3E%3C/defs%3E%3Crect width='1200' height='630' fill='url(%23g)'/%3E%3Cpath d='M120 480 Q 600 320 1080 480' stroke='%23f5d76e' stroke-width='10' fill='none' stroke-dasharray='2 18' stroke-linecap='round'/%3E%3Ccircle cx='120' cy='480' r='14' fill='%23f5d76e'/%3E%3Ccircle cx='1080' cy='480' r='14' fill='%23f5d76e'/%3E%3Ctext x='60' y='200' fill='%23ffffff' font-family='system-ui,sans-serif' font-size='84' font-weight='700'%3EThe Hijra%3C/text%3E%3Ctext x='60' y='260' fill='%23dfece6' font-family='system-ui,sans-serif' font-size='34'%3EMecca → Medina · 622 CE / 1 AH%3C/text%3E%3Ctext x='110' y='525' fill='%23ffffff' font-family='system-ui,sans-serif' font-size='22'%3EMecca%3C/text%3E%3Ctext x='1010' y='525' fill='%23ffffff' font-family='system-ui,sans-serif' font-size='22'%3EMedina%3C/text%3E%3C/svg%3E",
  "license": "CC-BY-4.0",
  "attribution": { "en": "islamicmaps.org" }
}
