{
  "id": "umrah-cover",
  "type": "asset",
  "media": "image",
  "title": { "en": "How to Perform Umrah — cover", "ar": "غلاف: كيفية أداء العمرة" },
  "alt_text": { "en": "Stylised cover image for the Umrah story showing the Kaaba within concentric tawaf circles" },
  "src": "data:image/svg+xml;utf8,%3Csvg xmlns='http://www.w3.org/2000/svg' viewBox='0 0 1200 630' width='1200' height='630'%3E%3Cdefs%3E%3ClinearGradient id='g' x1='0' x2='0' y1='0' y2='1'%3E%3Cstop offset='0' stop-color='%23123c2a'/%3E%3Cstop offset='1' stop-color='%231f7a4d'/%3E%3C/linearGradient%3E%3C/defs%3E%3Crect width='1200' height='630' fill='url(%23g)'/%3E%3Cg transform='translate(900 315)' fill='none' stroke='%23f5d76e' stroke-width='2' opacity='0.55'%3E%3Ccircle r='90'/%3E%3Ccircle r='150'/%3E%3Ccircle r='220'/%3E%3Ccircle r='300'/%3E%3C/g%3E%3Cg transform='translate(852 267)'%3E%3Crect width='96' height='96' fill='%23111111' rx='6'/%3E%3Crect y='28' width='96' height='14' fill='%23c4a76a'/%3E%3C/g%3E%3Ctext x='60' y='220' fill='%23ffffff' font-family='system-ui,sans-serif' font-size='80' font-weight='700'%3EHow to%3C/text%3E%3Ctext x='60' y='310' fill='%23ffffff' font-family='system-ui,sans-serif' font-size='80' font-weight='700'%3EPerform Umrah%3C/text%3E%3Ctext x='60' y='370' fill='%23dfece6' font-family='system-ui,sans-serif' font-size='30'%3EIhram · Tawaf · Sa'i · Halq%3C/text%3E%3C/svg%3E",
  "license": "CC-BY-4.0",
  "attribution": { "en": "islamicmaps.org" }
}
